{
  "schema_version": 1,
  "resolution_id": "99999999-9999-4999-8999-999999999999",
  "status": "accepted",
  "action": "close",
  "incident": {
    "schema_version": 1,
    "incident_id": "66666666-6666-4666-8666-666666666666",
    "user_id": "demo-user-1",
    "kind": "fall",
    "state": "resolved",
    "trigger_event_id": "55555555-5555-4555-8555-555555555555",
    "location": {
      "latitude": 41.8781,
      "longitude": -87.6298,
      "horizontal_accuracy_m": 8.0,
      "captured_at": "2026-07-18T14:32:05Z"
    },
    "simulated": false,
    "health_snapshot_id": "dddddddd-dddd-4ddd-8ddd-dddddddddddd",
    "opened_at": "2026-07-18T14:32:06Z",
    "updated_at": "2026-07-18T14:34:10Z",
    "verification_expires_at": "2026-07-18T14:32:21Z",
    "resolved_at": "2026-07-18T14:34:10Z",
    "state_version": 4
  },
  "transition": {
    "schema_version": 1,
    "transition_id": "aaaaaaaa-aaaa-4aaa-8aaa-aaaaaaaaaaaa",
    "incident_id": "66666666-6666-4666-8666-666666666666",
    "sequence": 4,
    "from_state": "response_active",
    "to_state": "resolved",
    "trigger": "close",
    "occurred_at": "2026-07-18T14:34:10Z",
    "source_event_id": null,
    "check_in_id": null,
    "simulated": false
  },
  "server_received_at": "2026-07-18T14:34:10Z"
}
